{
 "id": "monster-roc",
 "name": "Rocs",
 "name_raw": null,
 "aliases": [],
 "system": "openfrp74",
 "number_appearing_raw": "1 - 20",
 "number_appearing": {
  "min": 1,
  "max": 20,
  "note": null
 },
 "armor_class_raw": "4",
 "armor_class": 4,
 "move_raw": "6/48",
 "move_inches": 6,
 "fly_inches": 48,
 "hit_dice_raw": "6",
 "hit_dice": {
  "min": 6,
  "max": 6,
  "bonus": 0,
  "note": "small variety; double/treble for largest"
 },
 "percent_in_lair_raw": "20%",
 "percent_in_lair": 20,
 "treasure_raw": "Type I",
 "treasure_refs": [
  "treasure-type-i"
 ],
 "alignment": [
  "law"
 ],
 "description": "A name stretched to cover all great fierce birds — though the Roc of legend preys on elephants, so the listed figures are for the small kind: double or treble them for the largest. Rocs nest in the most inaccessible peaks; in the lair there is a 50% chance of 1-6 young (eggs, chicks, fledglings), which can be tamed as steeds. Adults with young in the nest are always hostile; otherwise hostile only to Chaos and Neutrality, ignoring (80%) or befriending (20%) Lawful characters who keep a respectful distance.",
 "special_notes": [
  "young tameable as steeds"
 ],
 "related_monsters": [],
 "statline_shared_with": null,
 "interpretation_records": [],
 "period_conventions": [
  "source cites Tolkien's Eagles; text stands per D-7"
 ],
 "external_refs": [],
 "source": {
  "work": "OpenFRP74",
  "booklet": "v2",
  "page": "p17",
  "blocks": [
   2
  ],
  "content_sha256": [
   "97493ee99d435a4d80f93bd677b1623e9f22f001506fff960944d1db8723e302"
  ],
  "also": [
   {
    "booklet": "v2",
    "page": "p04",
    "blocks": [
     1
    ],
    "content_sha256": [
     "47856cfb64ced75d3214b0f00ee3fb605bdc7622b3654c0832417f74a39c0d33"
    ],
    "note": "monster reference table"
   },
   {
    "booklet": "v1",
    "page": "p09",
    "blocks": [
     1,
     2,
     3,
     4
    ],
    "content_sha256": [
     "17a081de19c97c9f20f6d6754b61c088cc50397b6b43b039b88e4c43a6fa2f73",
     "d3b4f366e3f383ed39ac69f3cf1fa887eeb862045bc5bd1672d8970a1d85d96f",
     "0ce11842d10f5a62253c44c16872d3b3df8c23b2346d9fe7ec0607f7d80b31ac",
     "91363b8eebe4676b3aedc305798799be8645b73482ed46001c582319903c5d4c"
    ],
    "note": "alignment lists (errata applied per ir-a13)"
   }
  ]
 },
 "extraction": {
  "date": "2026-07-17",
  "model": "claude-opus-4-8",
  "notes": null
 }
}
