{
 "id": "monster-troll",
 "name": "Trolls",
 "name_raw": null,
 "aliases": [],
 "system": "openfrp74",
 "number_appearing_raw": "2 - 12",
 "number_appearing": {
  "min": 2,
  "max": 12,
  "note": null
 },
 "armor_class_raw": "4",
 "armor_class": 4,
 "move_raw": "12",
 "move_inches": 12,
 "fly_inches": null,
 "hit_dice_raw": "6 +3",
 "hit_dice": {
  "min": 6,
  "max": 6,
  "bonus": 3,
  "note": null
 },
 "percent_in_lair_raw": "50%",
 "percent_in_lair": 50,
 "treasure_raw": "Type D",
 "treasure_refs": [
  "treasure-type-d"
 ],
 "alignment": [
  "chaos"
 ],
 "description": "Thin, rubbery, and loathsome, Trolls regenerate: from the third melee round after being struck, each repairs 3 hit points per turn, and even a sundered Troll knits itself whole and rejoins the fight at 6 or more points — only burning or a bath of acid ends it. About as strong as an Ogre, but fighting with talon and fang for a single die of damage.",
 "special_notes": [
  "regenerates 3 hp/turn from 3rd round after a hit",
  "destroyed only by fire or acid",
  "damage 1d6"
 ],
 "related_monsters": [],
 "statline_shared_with": null,
 "interpretation_records": [],
 "period_conventions": [],
 "external_refs": [],
 "source": {
  "work": "OpenFRP74",
  "booklet": "v2",
  "page": "p08",
  "blocks": [
   6
  ],
  "content_sha256": [
   "5d4e8b64e628075073eda14382cf3ac3d41248ef71b7b2baee5fa0a7aa91e160"
  ],
  "also": [
   {
    "booklet": "v2",
    "page": "p03",
    "blocks": [
     3
    ],
    "content_sha256": [
     "00ce7196ca798dc5c5a582d93bbf74875152461c6716377cd1b06df00155b12f"
    ],
    "note": "monster reference table"
   },
   {
    "booklet": "v1",
    "page": "p09",
    "blocks": [
     1,
     2,
     3,
     4
    ],
    "content_sha256": [
     "17a081de19c97c9f20f6d6754b61c088cc50397b6b43b039b88e4c43a6fa2f73",
     "d3b4f366e3f383ed39ac69f3cf1fa887eeb862045bc5bd1672d8970a1d85d96f",
     "0ce11842d10f5a62253c44c16872d3b3df8c23b2346d9fe7ec0607f7d80b31ac",
     "91363b8eebe4676b3aedc305798799be8645b73482ed46001c582319903c5d4c"
    ],
    "note": "alignment lists (errata applied per ir-a13)"
   }
  ]
 },
 "extraction": {
  "date": "2026-07-17",
  "model": "claude-opus-4-8",
  "notes": null
 }
}
