{
 "id": "monster-unicorn",
 "name": "Unicorns",
 "name_raw": null,
 "aliases": [],
 "system": "openfrp74",
 "number_appearing_raw": "1 - 4",
 "number_appearing": {
  "min": 1,
  "max": 4,
  "note": null
 },
 "armor_class_raw": "2",
 "armor_class": 2,
 "move_raw": "24",
 "move_inches": 24,
 "fly_inches": null,
 "hit_dice_raw": "4",
 "hit_dice": {
  "min": 4,
  "max": 4,
  "bonus": 0,
  "note": null
 },
 "percent_in_lair_raw": "Nil",
 "percent_in_lair": null,
 "treasure_raw": "Nil",
 "treasure_refs": [],
 "alignment": [
  "law"
 ],
 "description": "Fierce, elusive, and approachable only by a maiden — in the strictest sense — pure and noble of heart; maiden-warriors may ride them and be obeyed. Otherwise they shun human contact unless pressed. Attacking, a Unicorn fights as a lance on its first charge and as spear-and-heavy-horse after. Deeply magical: it resists magic as an 11th-level Magic-User, senses enemies at 24\", and once a day carries itself and rider as by a Dimension Door, the full 36\".",
 "special_notes": [
  "magic resistance as 11th-level M-U",
  "enemy sense 24\"",
  "1/day Dimension Door, 36\""
 ],
 "related_monsters": [],
 "statline_shared_with": null,
 "interpretation_records": [],
 "period_conventions": [],
 "external_refs": [],
 "source": {
  "work": "OpenFRP74",
  "booklet": "v2",
  "page": "p15",
  "blocks": [
   5
  ],
  "content_sha256": [
   "ca70f47a937295431aab1ce2237f6c681455fd3b609f4ebb5f198f5987e954a1"
  ],
  "also": [
   {
    "booklet": "v2",
    "page": "p03",
    "blocks": [
     3
    ],
    "content_sha256": [
     "00ce7196ca798dc5c5a582d93bbf74875152461c6716377cd1b06df00155b12f"
    ],
    "note": "monster reference table"
   },
   {
    "booklet": "v1",
    "page": "p09",
    "blocks": [
     1,
     2,
     3,
     4
    ],
    "content_sha256": [
     "17a081de19c97c9f20f6d6754b61c088cc50397b6b43b039b88e4c43a6fa2f73",
     "d3b4f366e3f383ed39ac69f3cf1fa887eeb862045bc5bd1672d8970a1d85d96f",
     "0ce11842d10f5a62253c44c16872d3b3df8c23b2346d9fe7ec0607f7d80b31ac",
     "91363b8eebe4676b3aedc305798799be8645b73482ed46001c582319903c5d4c"
    ],
    "note": "alignment lists (errata applied per ir-a13)"
   }
  ]
 },
 "extraction": {
  "date": "2026-07-17",
  "model": "claude-opus-4-8",
  "notes": null
 }
}
