{
 "id": "monster-earth-elemental",
 "name": "Earth Elementals",
 "name_raw": null,
 "aliases": [],
 "system": "openfrp74",
 "number_appearing_raw": "1",
 "number_appearing": {
  "min": 1,
  "max": 1,
  "note": null
 },
 "armor_class_raw": "2",
 "armor_class": 2,
 "move_raw": "6",
 "move_inches": 6,
 "fly_inches": null,
 "hit_dice_raw": "16/12/8",
 "hit_dice": {
  "min": 8,
  "max": 16,
  "bonus": 0,
  "note": null
 },
 "percent_in_lair_raw": "Nil",
 "percent_in_lair": null,
 "treasure_raw": "Nil",
 "treasure_refs": [],
 "alignment": [
  "neutrality"
 ],
 "description": "Moving but 6\" and never across water, it strikes for three dice (3-18) against any foe standing on the earth, two dice otherwise — and batters walls like a superb ram, 3-18 points a blow. All common Elemental rules apply.",
 "special_notes": [
  "3d6 vs grounded foes; 2d6 otherwise",
  "cannot cross water",
  "ram vs walls 3-18"
 ],
 "related_monsters": [
  "monster-elemental"
 ],
 "statline_shared_with": null,
 "counterpart_5_1srd": "monster-earth-elemental",
 "interpretation_records": [],
 "period_conventions": [],
 "external_refs": [],
 "source": {
  "work": "OpenFRP74",
  "booklet": "v2",
  "page": "p18",
  "blocks": [
   7
  ],
  "content_sha256": [
   "633cc4fce1c5697ddb514d6180c7738618e1beed96c8979db3771bdf18a4c543"
  ],
  "also": [
   {
    "booklet": "v2",
    "page": "p04",
    "blocks": [
     1
    ],
    "content_sha256": [
     "47856cfb64ced75d3214b0f00ee3fb605bdc7622b3654c0832417f74a39c0d33"
    ],
    "note": "monster reference table"
   }
  ]
 },
 "extraction": {
  "date": "2026-07-17",
  "model": "claude-opus-4-8",
  "notes": null
 }
}
