{
 "id": "monster-wraith",
 "name": "Wraiths",
 "name_raw": null,
 "aliases": [],
 "system": "openfrp74",
 "number_appearing_raw": "2 - 16",
 "number_appearing": {
  "min": 2,
  "max": 16,
  "note": null
 },
 "armor_class_raw": "3",
 "armor_class": 3,
 "move_raw": "12/24",
 "move_inches": 12,
 "fly_inches": 24,
 "hit_dice_raw": "4",
 "hit_dice": {
  "min": 4,
  "max": 4,
  "bonus": 0,
  "note": null
 },
 "percent_in_lair_raw": "20%",
 "percent_in_lair": 20,
 "treasure_raw": "Type E",
 "treasure_refs": [
  "treasure-type-e"
 ],
 "alignment": [
  "chaos"
 ],
 "description": "High-class Wights: swifter, tougher, richer. Against them silver-tipped arrows score only half a die and magic arrows a single die.",
 "special_notes": [
  "energy drain as Wights: 1 level/hit",
  "silver arrows ½ die; magic arrows 1 die"
 ],
 "related_monsters": [
  "monster-wight"
 ],
 "statline_shared_with": null,
 "interpretation_records": [],
 "period_conventions": [],
 "external_refs": [],
 "source": {
  "work": "OpenFRP74",
  "booklet": "v2",
  "page": "p09",
  "blocks": [
   4
  ],
  "content_sha256": [
   "e3ef756474c9ea4ad7c43aa0e6ce2081597fccb14538a8d33e1f88145009b666"
  ],
  "also": [
   {
    "booklet": "v2",
    "page": "p03",
    "blocks": [
     3
    ],
    "content_sha256": [
     "00ce7196ca798dc5c5a582d93bbf74875152461c6716377cd1b06df00155b12f"
    ],
    "note": "monster reference table"
   },
   {
    "booklet": "v1",
    "page": "p09",
    "blocks": [
     1,
     2,
     3,
     4
    ],
    "content_sha256": [
     "17a081de19c97c9f20f6d6754b61c088cc50397b6b43b039b88e4c43a6fa2f73",
     "d3b4f366e3f383ed39ac69f3cf1fa887eeb862045bc5bd1672d8970a1d85d96f",
     "0ce11842d10f5a62253c44c16872d3b3df8c23b2346d9fe7ec0607f7d80b31ac",
     "91363b8eebe4676b3aedc305798799be8645b73482ed46001c582319903c5d4c"
    ],
    "note": "alignment lists (errata applied per ir-a13)"
   }
  ]
 },
 "extraction": {
  "date": "2026-07-17",
  "model": "claude-opus-4-8",
  "notes": null
 }
}
