{
 "id": "monster-vampire",
 "name": "Vampires",
 "name_raw": null,
 "aliases": [],
 "system": "openfrp74",
 "number_appearing_raw": "1 - 6",
 "number_appearing": {
  "min": 1,
  "max": 6,
  "note": null
 },
 "armor_class_raw": "2",
 "armor_class": 2,
 "move_raw": "12/18",
 "move_inches": 12,
 "fly_inches": 18,
 "hit_dice_raw": "7-9",
 "hit_dice": {
  "min": 7,
  "max": 9,
  "bonus": 0,
  "note": null
 },
 "percent_in_lair_raw": "20%",
 "percent_in_lair": 20,
 "treasure_raw": "Type F",
 "treasure_refs": [
  "treasure-type-f"
 ],
 "alignment": [
  "chaos"
 ],
 "description": "Undead — not Lycanthropes, whatever older texts say. Direct sunlight, running water, or a wooden stake through the heart kills them; nothing else does. They are hit only as Spectres are, and even then loss of all hit points merely drives them into gaseous form. Their blow drains two life energy levels; they regenerate 3 hit points per turn the moment they are struck. They summon aid at will — 10-100 rats or bats, or 3-18 wolves — and shift at will into a great bat or into vapor. Their gaze Charms men-types (as Charm Person, victim's save at −2). Garlic, a mirror's face, or a cross strongly presented drives them back; by day they must lie in a coffin floored with the soil of their homeland. Their victims rise as Vampires in thrall to their maker.",
 "special_notes": [
  "killed only by sunlight, running water, or wooden stake",
  "hit only by magic weapons; 0 hp → gaseous form",
  "energy drain 2 levels/hit",
  "regenerates 3 hp/turn immediately",
  "gaze charm: Charm Person, save −2",
  "summons 10-100 rats/bats or 3-18 wolves",
  "victims become enslaved Vampires"
 ],
 "related_monsters": [
  "monster-spectre",
  "monster-troll"
 ],
 "statline_shared_with": null,
 "interpretation_records": [],
 "period_conventions": [],
 "external_refs": [],
 "source": {
  "work": "OpenFRP74",
  "booklet": "v2",
  "page": "p09",
  "blocks": [
   7
  ],
  "content_sha256": [
   "880c9ae6f73e9b613bb6a4d9ded9ac339fbba19aeea61d01b047b6eb0ee858d9"
  ],
  "also": [
   {
    "booklet": "v2",
    "page": "p10",
    "blocks": [
     0
    ],
    "content_sha256": [
     "519c23b728bd327e46d9b24acaea5679c60d7e255cd83ca0e0be67669a977ddc"
    ],
    "note": "entry concludes"
   },
   {
    "booklet": "v2",
    "page": "p03",
    "blocks": [
     3
    ],
    "content_sha256": [
     "00ce7196ca798dc5c5a582d93bbf74875152461c6716377cd1b06df00155b12f"
    ],
    "note": "monster reference table"
   },
   {
    "booklet": "v1",
    "page": "p09",
    "blocks": [
     1,
     2,
     3,
     4
    ],
    "content_sha256": [
     "17a081de19c97c9f20f6d6754b61c088cc50397b6b43b039b88e4c43a6fa2f73",
     "d3b4f366e3f383ed39ac69f3cf1fa887eeb862045bc5bd1672d8970a1d85d96f",
     "0ce11842d10f5a62253c44c16872d3b3df8c23b2346d9fe7ec0607f7d80b31ac",
     "91363b8eebe4676b3aedc305798799be8645b73482ed46001c582319903c5d4c"
    ],
    "note": "alignment lists (errata applied per ir-a13)"
   }
  ]
 },
 "extraction": {
  "date": "2026-07-17",
  "model": "claude-opus-4-8",
  "notes": null
 }
}
