{
 "id": "monster-invisible-stalker",
 "name": "Invisible Stalkers",
 "name_raw": null,
 "aliases": [],
 "system": "openfrp74",
 "number_appearing_raw": "- - - - - -",
 "number_appearing": null,
 "armor_class_raw": "3",
 "armor_class": 3,
 "move_raw": "12",
 "move_inches": 12,
 "fly_inches": null,
 "hit_dice_raw": "8",
 "hit_dice": {
  "min": 8,
  "max": 8,
  "bonus": 0,
  "note": null
 },
 "percent_in_lair_raw": "Nil",
 "percent_in_lair": null,
 "treasure_raw": "Nil",
 "treasure_refs": [],
 "alignment": [
  "neutrality"
 ],
 "description": "Summoned by the 6th-level spell (spoken or from scrolls), a faultless tracker that follows until its mission is done, then returns to its non-dimension. It never wavers and is stopped only by destruction — or Dispel Magic. But it resents long service: set to endless duty (guard me a month, a year), it will honor the letter while perverting the spirit — carrying its ward to its own non-dimensional plane into suspended animation; assume this succeeds on a 12 with 2d6, checked daily or weekly.",
 "special_notes": [
  "faultless tracker",
  "stopped only by destruction or Dispel Magic",
  "letter-vs-spirit subversion on open-ended missions (2d6=12 check)"
 ],
 "related_monsters": [],
 "statline_shared_with": null,
 "interpretation_records": [],
 "period_conventions": [],
 "external_refs": [],
 "source": {
  "work": "OpenFRP74",
  "booklet": "v2",
  "page": "p18",
  "blocks": [
   1
  ],
  "content_sha256": [
   "9d57171bd3af0546c62d00bb0cfb56e7342078cae160d511cd44b5b56ed8099a"
  ],
  "also": [
   {
    "booklet": "v2",
    "page": "p04",
    "blocks": [
     1
    ],
    "content_sha256": [
     "47856cfb64ced75d3214b0f00ee3fb605bdc7622b3654c0832417f74a39c0d33"
    ],
    "note": "monster reference table"
   }
  ]
 },
 "extraction": {
  "date": "2026-07-17",
  "model": "claude-opus-4-8",
  "notes": null
 }
}
