{
 "id": "monster-large-insects-or-animals",
 "name": "Large Insects or Animals",
 "name_raw": null,
 "aliases": [],
 "system": "openfrp74",
 "number_appearing_raw": "2 - 16",
 "number_appearing": {
  "min": 2,
  "max": 16,
  "note": null
 },
 "armor_class_raw": "8 to 2",
 "armor_class": null,
 "move_raw": "Variable",
 "move_inches": null,
 "fly_inches": null,
 "hit_dice_raw": "2 to ~20",
 "hit_dice": {
  "min": 2,
  "max": 20,
  "bonus": 0,
  "note": null
 },
 "percent_in_lair_raw": null,
 "percent_in_lair": null,
 "treasure_raw": null,
 "treasure_refs": [],
 "alignment": [
  "neutrality"
 ],
 "description": "Giant ants to prehistoric monsters: Armor Class anywhere from 8 to 2, hit dice from 2 to near 20 (say, for a Tyrannosaurus Rex). The optional Martian beasts — Apts, Banths, Thoats and the rest — belong here too. Where the referee doesn't know a creature, poll the campaign's players to fix its characteristics.",
 "special_notes": [],
 "related_monsters": [],
 "statline_shared_with": null,
 "interpretation_records": [],
 "period_conventions": [
  "\"Martain\"/\"Tyrannasaurus\" printed; normalized; Barsoom names stand per D-7"
 ],
 "external_refs": [],
 "source": {
  "work": "OpenFRP74",
  "booklet": "v2",
  "page": "p20",
  "blocks": [
   7
  ],
  "content_sha256": [
   "4ec3de3ed12e17a8af1d869c96493c5fb6b7577f04b763868a993d3f1289ac88"
  ],
  "also": [
   {
    "booklet": "v2",
    "page": "p04",
    "blocks": [
     1
    ],
    "content_sha256": [
     "47856cfb64ced75d3214b0f00ee3fb605bdc7622b3654c0832417f74a39c0d33"
    ],
    "note": "monster reference table"
   }
  ]
 },
 "extraction": {
  "date": "2026-07-17",
  "model": "claude-opus-4-8",
  "notes": null
 }
}
