{
 "id": "monster-men",
 "name": "Men",
 "name_raw": null,
 "aliases": [],
 "system": "openfrp74",
 "number_appearing_raw": "30 - 300",
 "number_appearing": {
  "min": 30,
  "max": 300,
  "note": null
 },
 "armor_class_raw": "All variable",
 "armor_class": null,
 "move_raw": null,
 "move_inches": null,
 "fly_inches": null,
 "hit_dice_raw": "1 die/man",
 "hit_dice": {
  "min": 1,
  "max": 1,
  "bonus": 0,
  "note": "per the Bandits Hit Dice line"
 },
 "percent_in_lair_raw": "15%",
 "percent_in_lair": 15,
 "treasure_raw": "Type A",
 "treasure_refs": [
  "treasure-type-a"
 ],
 "alignment": [
  "law",
  "neutrality",
  "chaos"
 ],
 "description": "The most numerous encounter of all, met in several categories — Bandits, Berserkers, Brigands, Dervishes, Nomads, Buccaneers, Pirates, Cavemen, Mermen — each detailed in its own entry. Armor, movement, and the like vary by category; every man fights with one hit die.",
 "special_notes": [],
 "related_monsters": [
  "monster-bandit",
  "monster-berserker",
  "monster-brigand",
  "monster-dervish",
  "monster-nomad",
  "monster-buccaneer",
  "monster-pirate",
  "monster-caveman",
  "monster-merman"
 ],
 "statline_shared_with": null,
 "counterpart_5_1srd": null,
 "interpretation_records": [],
 "period_conventions": [],
 "external_refs": [],
 "source": {
  "work": "OpenFRP74",
  "booklet": "v2",
  "page": "p05",
  "blocks": [
   3
  ],
  "content_sha256": [
   "2a12d56fed34b1162d71d6d82d5db2bb854615bb2ff368affe6ba6c8e1c7b629"
  ],
  "also": [
   {
    "booklet": "v2",
    "page": "p03",
    "blocks": [
     3
    ],
    "content_sha256": [
     "00ce7196ca798dc5c5a582d93bbf74875152461c6716377cd1b06df00155b12f"
    ],
    "note": "monster reference table"
   },
   {
    "booklet": "v1",
    "page": "p09",
    "blocks": [
     1,
     2,
     3,
     4
    ],
    "content_sha256": [
     "17a081de19c97c9f20f6d6754b61c088cc50397b6b43b039b88e4c43a6fa2f73",
     "d3b4f366e3f383ed39ac69f3cf1fa887eeb862045bc5bd1672d8970a1d85d96f",
     "0ce11842d10f5a62253c44c16872d3b3df8c23b2346d9fe7ec0607f7d80b31ac",
     "91363b8eebe4676b3aedc305798799be8645b73482ed46001c582319903c5d4c"
    ],
    "note": "alignment lists (errata applied per ir-a13)"
   }
  ]
 },
 "extraction": {
  "date": "2026-07-17",
  "model": "claude-opus-4-8",
  "notes": null
 }
}
