{
 "id": "monster-manticora",
 "name": "Manticoras",
 "name_raw": "Manticoras",
 "aliases": [
  "Manticores"
 ],
 "system": "openfrp74",
 "number_appearing_raw": "1 - 4",
 "number_appearing": {
  "min": 1,
  "max": 4,
  "note": null
 },
 "armor_class_raw": "4",
 "armor_class": 4,
 "move_raw": "12/18",
 "move_inches": 12,
 "fly_inches": 18,
 "hit_dice_raw": "6 +1",
 "hit_dice": {
  "min": 6,
  "max": 6,
  "bonus": 1,
  "note": null
 },
 "percent_in_lair_raw": "25%",
 "percent_in_lair": 25,
 "treasure_raw": "Type D",
 "treasure_refs": [
  "treasure-type-d"
 ],
 "alignment": [
  "chaos"
 ],
 "description": "Huge lion-bodied monstrosities — man's face, horns, dragon wings, and a tail bristling with 24 iron spikes, fired six at a time in any direction with a crossbow's range (18\"), accuracy, and effect. Their favorite prey is man.",
 "special_notes": [
  "tail spikes: 24 total, 6/volley, as crossbow at 18\""
 ],
 "related_monsters": [],
 "statline_shared_with": null,
 "counterpart_5_1srd": "monster-manticore",
 "interpretation_records": [],
 "period_conventions": [
  "period spelling Manticoras/Manticores kept as alias"
 ],
 "external_refs": [],
 "source": {
  "work": "OpenFRP74",
  "booklet": "v2",
  "page": "p10",
  "blocks": [
   5
  ],
  "content_sha256": [
   "11a2b1afb2ef720f5a2539c45cb09743d1181aa3a218a91c48bcd8fea170fd84"
  ],
  "also": [
   {
    "booklet": "v2",
    "page": "p03",
    "blocks": [
     3
    ],
    "content_sha256": [
     "00ce7196ca798dc5c5a582d93bbf74875152461c6716377cd1b06df00155b12f"
    ],
    "note": "monster reference table"
   },
   {
    "booklet": "v1",
    "page": "p09",
    "blocks": [
     1,
     2,
     3,
     4
    ],
    "content_sha256": [
     "17a081de19c97c9f20f6d6754b61c088cc50397b6b43b039b88e4c43a6fa2f73",
     "d3b4f366e3f383ed39ac69f3cf1fa887eeb862045bc5bd1672d8970a1d85d96f",
     "0ce11842d10f5a62253c44c16872d3b3df8c23b2346d9fe7ec0607f7d80b31ac",
     "91363b8eebe4676b3aedc305798799be8645b73482ed46001c582319903c5d4c"
    ],
    "note": "alignment lists (errata applied per ir-a13)"
   }
  ]
 },
 "extraction": {
  "date": "2026-07-17",
  "model": "claude-opus-4-8",
  "notes": null
 }
}
