{
 "id": "monster-centaur",
 "name": "Centaurs",
 "name_raw": null,
 "aliases": [],
 "system": "openfrp74",
 "number_appearing_raw": "2 - 20",
 "number_appearing": {
  "min": 2,
  "max": 20,
  "note": null
 },
 "armor_class_raw": "5",
 "armor_class": 5,
 "move_raw": "18",
 "move_inches": 18,
 "fly_inches": null,
 "hit_dice_raw": "4",
 "hit_dice": {
  "min": 4,
  "max": 4,
  "bonus": 0,
  "note": null
 },
 "percent_in_lair_raw": "05%",
 "percent_in_lair": 5,
 "treasure_raw": "Type A",
 "treasure_refs": [
  "treasure-type-a"
 ],
 "alignment": [
  "law",
  "neutrality"
 ],
 "description": "Semi-intelligent at worst, so always armed: half a band carries clubs (as morning stars), a quarter lance-like spears, the rest composite bows. In melee a Centaur strikes twice — once as a man, once as a medium horse. They den in hidden glens with their females (twice the males' number, unarmed), their young (equal to the males, non-combatant save in extremity), 1-6 additional males, and their treasure.",
 "special_notes": [
  "two attacks: as man + as medium horse"
 ],
 "related_monsters": [],
 "statline_shared_with": null,
 "interpretation_records": [],
 "period_conventions": [],
 "external_refs": [],
 "source": {
  "work": "OpenFRP74",
  "booklet": "v2",
  "page": "p15",
  "blocks": [
   4
  ],
  "content_sha256": [
   "81ddedd34017e57c95b5e798c35231707c765b63fa17dde1475b0fd04876c2dc"
  ],
  "also": [
   {
    "booklet": "v2",
    "page": "p03",
    "blocks": [
     3
    ],
    "content_sha256": [
     "00ce7196ca798dc5c5a582d93bbf74875152461c6716377cd1b06df00155b12f"
    ],
    "note": "monster reference table"
   },
   {
    "booklet": "v1",
    "page": "p09",
    "blocks": [
     1,
     2,
     3,
     4
    ],
    "content_sha256": [
     "17a081de19c97c9f20f6d6754b61c088cc50397b6b43b039b88e4c43a6fa2f73",
     "d3b4f366e3f383ed39ac69f3cf1fa887eeb862045bc5bd1672d8970a1d85d96f",
     "0ce11842d10f5a62253c44c16872d3b3df8c23b2346d9fe7ec0607f7d80b31ac",
     "91363b8eebe4676b3aedc305798799be8645b73482ed46001c582319903c5d4c"
    ],
    "note": "alignment lists (errata applied per ir-a13)"
   }
  ]
 },
 "extraction": {
  "date": "2026-07-17",
  "model": "claude-opus-4-8",
  "notes": null
 }
}
