{
 "id": "monster-light-horse",
 "name": "Light Horse",
 "name_raw": null,
 "aliases": [],
 "system": "openfrp74",
 "number_appearing_raw": "- - - - - -",
 "number_appearing": null,
 "armor_class_raw": "7",
 "armor_class": 7,
 "move_raw": "24",
 "move_inches": 24.0,
 "fly_inches": null,
 "hit_dice_raw": "2",
 "hit_dice": {
  "min": 2,
  "max": 2,
  "bonus": 0,
  "note": null
 },
 "percent_in_lair_raw": "Nil",
 "percent_in_lair": null,
 "treasure_raw": "Nil",
 "treasure_refs": [],
 "alignment": [
  "neutrality"
 ],
 "description": "War-trained horses melee; the rest shy from raging fire and strange smells, battle-trained stock far less so. Carrying capacity: 3,000 Gold Pieces weight.",
 "special_notes": [],
 "related_monsters": [],
 "statline_shared_with": null,
 "counterpart_5_1srd": "monster-warhorse",
 "interpretation_records": [],
 "period_conventions": [],
 "external_refs": [
  "war horse melee per CHAINMAIL"
 ],
 "source": {
  "work": "OpenFRP74",
  "booklet": "v2",
  "page": "p20",
  "blocks": [
   3,
   4,
   5
  ],
  "content_sha256": [
   "bf53735b06518f8c2837685318a62e4e6b9c495043895daa074d504237311cfe",
   "8291d3cd9fa3972f6f5adaf8e85c01c3882ab4b526557d08cb235657dfd683ce",
   "e9a8f7cbe5c1422a5b21ccdd41dd5224f8086c481331a2cd83cd5c2ab682920a"
  ],
  "also": [
   {
    "booklet": "v2",
    "page": "p04",
    "blocks": [
     1
    ],
    "content_sha256": [
     "47856cfb64ced75d3214b0f00ee3fb605bdc7622b3654c0832417f74a39c0d33"
    ],
    "note": "monster reference table"
   }
  ]
 },
 "extraction": {
  "date": "2026-07-17",
  "model": "claude-opus-4-8",
  "notes": null
 }
}
