{
 "id": "monster-water-elemental",
 "name": "Water Elementals",
 "name_raw": null,
 "aliases": [],
 "system": "openfrp74",
 "number_appearing_raw": "1",
 "number_appearing": {
  "min": 1,
  "max": 1,
  "note": null
 },
 "armor_class_raw": "2",
 "armor_class": 2,
 "move_raw": "18 in water / 6 ashore",
 "move_inches": 18,
 "fly_inches": null,
 "hit_dice_raw": "16/12/8",
 "hit_dice": {
  "min": 8,
  "max": 16,
  "bonus": 0,
  "note": null
 },
 "percent_in_lair_raw": "Nil",
 "percent_in_lair": null,
 "treasure_raw": "Nil",
 "treasure_refs": [],
 "alignment": [
  "neutrality"
 ],
 "description": "Bound to water — conjured only from a pond, stream, or greater body, straying at most 6\" from it — swimming at 18\", crawling at 6\" ashore; two dice of damage in the water, one die out of it. All common Elemental rules apply.",
 "special_notes": [
  "2d6 in water; 1d6 ashore",
  "max 6\" from water"
 ],
 "related_monsters": [
  "monster-elemental"
 ],
 "statline_shared_with": null,
 "interpretation_records": [],
 "period_conventions": [],
 "external_refs": [],
 "source": {
  "work": "OpenFRP74",
  "booklet": "v2",
  "page": "p19",
  "blocks": [
   0
  ],
  "content_sha256": [
   "9292360cf4fd6c4b7e21d4dc4ac906a7a4037d5d72fc928a252f1dbe9c4d5ff1"
  ],
  "also": [
   {
    "booklet": "v2",
    "page": "p04",
    "blocks": [
     1
    ],
    "content_sha256": [
     "47856cfb64ced75d3214b0f00ee3fb605bdc7622b3654c0832417f74a39c0d33"
    ],
    "note": "monster reference table"
   }
  ]
 },
 "extraction": {
  "date": "2026-07-17",
  "model": "claude-opus-4-8",
  "notes": null
 }
}
