{
 "id": "monster-small-insects-or-animals",
 "name": "Small Insects or Animals",
 "name_raw": null,
 "aliases": [],
 "system": "openfrp74",
 "number_appearing_raw": "6 - 36",
 "number_appearing": {
  "min": 6,
  "max": 36,
  "note": null
 },
 "armor_class_raw": "8 (generally)",
 "armor_class": 8,
 "move_raw": "Variable",
 "move_inches": null,
 "fly_inches": null,
 "hit_dice_raw": "up to 1",
 "hit_dice": {
  "min": 0,
  "max": 1,
  "bonus": 0,
  "note": null
 },
 "percent_in_lair_raw": null,
 "percent_in_lair": null,
 "treasure_raw": null,
 "treasure_refs": [],
 "alignment": [
  "neutrality"
 ],
 "description": "Any of a huge variety — wolves, centipedes, snakes, spiders. Any hit kills the smaller kinds; the larger (wolves, say) get one hit die. Generally Armor Class 8.",
 "special_notes": [],
 "related_monsters": [],
 "statline_shared_with": null,
 "interpretation_records": [],
 "period_conventions": [],
 "external_refs": [],
 "source": {
  "work": "OpenFRP74",
  "booklet": "v2",
  "page": "p20",
  "blocks": [
   6
  ],
  "content_sha256": [
   "11937f53e43993553046e108d6cb67eec86c3d00d0f82ce6fbd6149052c57fc7"
  ],
  "also": [
   {
    "booklet": "v2",
    "page": "p04",
    "blocks": [
     1
    ],
    "content_sha256": [
     "47856cfb64ced75d3214b0f00ee3fb605bdc7622b3654c0832417f74a39c0d33"
    ],
    "note": "monster reference table"
   }
  ]
 },
 "extraction": {
  "date": "2026-07-17",
  "model": "claude-opus-4-8",
  "notes": null
 }
}
